aiter/ops/triton/configs/gemm/MI350X-GEMM-A8W8_BLOCKSCALE-N=5120-K=4096.json
{
  "small": {
    "BLOCK_SIZE_M": 16,
    "BLOCK_SIZE_N": 128,
    "BLOCK_SIZE_K": 128,
    "GROUP_SIZE_M": 1,
    "NUM_KSPLIT": 32,
    "num_warps": 8,
    "num_stages": 1,
    "waves_per_eu": 1,
    "matrix_instr_nonkdim": 16,
    "cache_modifier": ".ca"
  },
  "medium_M32": {
    "BLOCK_SIZE_M": 16,
    "BLOCK_SIZE_N": 32,
    "BLOCK_SIZE_K": 128,
    "GROUP_SIZE_M": 1,
    "NUM_KSPLIT": 1,
    "num_warps": 8,
    "num_stages": 1,
    "waves_per_eu": 2,
    "matrix_instr_nonkdim": 16,
    "cache_modifier": ".ca"
  },
  "medium_M64": {
    "BLOCK_SIZE_M": 16,
    "BLOCK_SIZE_N": 32,
    "BLOCK_SIZE_K": 128,
    "GROUP_SIZE_M": 1,
    "NUM_KSPLIT": 1,
    "num_warps": 8,
    "num_stages": 1,
    "waves_per_eu": 2,
    "matrix_instr_nonkdim": 16,
    "cache_modifier": ".ca"
  },
  "medium_M128": {
    "BLOCK_SIZE_M": 16,
    "BLOCK_SIZE_N": 32,
    "BLOCK_SIZE_K": 128,
    "GROUP_SIZE_M": 1,
    "NUM_KSPLIT": 1,
    "num_warps": 8,
    "num_stages": 1,
    "waves_per_eu": 2,
    "matrix_instr_nonkdim": 16,
    "cache_modifier": ".ca"
  },
  "medium_M2000" : {
    "BLOCK_SIZE_M": 64,
    "BLOCK_SIZE_N": 256,
    "BLOCK_SIZE_K": 128,
    "GROUP_SIZE_M": 1,
    "NUM_KSPLIT": 1,
    "num_warps": 4,
    "num_stages": 1,
    "waves_per_eu": 2,
    "matrix_instr_nonkdim": 32,
    "cache_modifier": ".ca"
  },
  "medium_M6017" : {
    "BLOCK_SIZE_M": 64,
    "BLOCK_SIZE_N": 256,
    "BLOCK_SIZE_K": 128,
    "GROUP_SIZE_M": 2,
    "NUM_KSPLIT": 1,
    "num_warps": 4,
    "num_stages": 1,
    "waves_per_eu": 2,
    "matrix_instr_nonkdim": 32,
    "cache_modifier": ".ca"
  }
}
